{
  "schema_version": "v1",
  "artifact_type": "VerifierProfile.v1",
  "verifier_profile_id": "vp-opa-demo-001",
  "created_at": "2026-07-24T16:00:00Z",
  "producer": "OVK",
  "producer_version": "0.4.0",
  "source_repo": "https://github.com/SentinelOps-CI/open-verification-kernel",
  "source_commit": "e068794683959c52a19594a6d271dd5e69f3c999",
  "implementation": {
    "name": "open-verification-kernel",
    "version": "0.4.0",
    "language": "python",
    "entry_point": "ovk.adapters.self_protection.opa_adapter",
    "implementation_digest": "sha256:aaaaaaaaaaaaaaaaaaaaaaaaaaaaaaaaaaaaaaaaaaaaaaaaaaaaaaaaaaaaaaaa",
    "container_digest": "sha256:bbbbbbbbbbbbbbbbbbbbbbbbbbbbbbbbbbbbbbbbbbbbbbbbbbbbbbbbbbbbbbbb",
    "dependency_lock_digest": "sha256:cccccccccccccccccccccccccccccccccccccccccccccccccccccccccccccccc",
    "normalization_implementation_version": "ovk.normalize.v1"
  },
  "configuration": {
    "config_digest": "sha256:b79cf2b918a1d94c5537f3adccd6671484e5e18d16c681c2234625ab59a26253",
    "policy_digest": "sha256:dddddddddddddddddddddddddddddddddddddddddddddddddddddddddddddddd",
    "model_digest": null,
    "prompt_digest": null,
    "resource_limit_digest": "sha256:eeeeeeeeeeeeeeeeeeeeeeeeeeeeeeeeeeeeeeeeeeeeeeeeeeeeeeeeeeeeeeee",
    "rubric_digest": null,
    "test_suite_digest": "sha256:aaaaaaaaaaaaaaaaaaaaaaaaaaaaaaaaaaaaaaaaaaaaaaaaaaaaaaaaaaaaaaaa",
    "threshold_digest": null,
    "ensemble_digest": null
  },
  "mechanism": {
    "mechanism_class": "policy_engine",
    "determinism": "deterministic",
    "allows_abstention": true,
    "description": "OPA eval against pinned policy digest.",
    "requires_external_execution": true
  },
  "claim_surface": {
    "supported_claim_ids": [
      "policy.allow"
    ],
    "guarantee_class": "runtime_observed",
    "out_of_scope_claim_ids": [
      "formal.safety"
    ],
    "decision_space": [
      "accept",
      "reject",
      "indeterminate_execution_error",
      "indeterminate_out_of_scope"
    ]
  },
  "applicability": {
    "status": "active",
    "valid_from": "2026-07-24T00:00:00Z",
    "environment_families": [
      "ci",
      "local"
    ]
  },
  "assumptions": [
    "opa binary digest matches implementation.container_digest or dependency pin"
  ],
  "known_blind_spots": [
    "Does not prove policy correctness; observational allow/deny only"
  ],
  "configuration_schema_digest": "sha256:453c4bd8f59a21a4207c4ab537f2edc9c3b952a9357b7c6006812229c831848d",
  "configuration_schema": {
    "type": "object",
    "required": [
      "backend",
      "rego_package",
      "query"
    ]
  },
  "canonical_configuration": {
    "backend": "opa-native",
    "rego_package": "data.ovk.policy",
    "query": "data.ovk.policy.allow"
  },
  "redacted_environment": {
    "redaction_policy_id": "ovk-redact-v1",
    "entries": {
      "OPA_LOG_LEVEL": "error",
      "CI": "true"
    },
    "redacted_keys": [
      "OPA_TOKEN",
      "GITHUB_TOKEN"
    ],
    "environment_digest": "sha256:eeeeeeeeeeeeeeeeeeeeeeeeeeeeeeeeeeeeeeeeeeeeeeeeeeeeeeeeeeeeeeee"
  },
  "external_dependencies": [
    {
      "dependency_id": "opa",
      "kind": "binary",
      "identity": "opa",
      "version": "0.68.0",
      "digest": "sha256:aaaaaaaaaaaaaaaaaaaaaaaaaaaaaaaaaaaaaaaaaaaaaaaaaaaaaaaaaaaaaaaa"
    }
  ],
  "execution_controls": {
    "timeout_ms": 30000
  },
  "limitations_notice": "Profile binds configuration and digests only; it does not claim policy correctness beyond recorded checker results.",
  "integrity": {
    "canonicalization_version": "v1",
    "artifact_digest": "sha256:a4499695423937d2fedb86b5dfd21e65a053cc02c78c38f35e77ce8a98a42a44"
  }
}
